style,role,occasion,description
casual,"a small-framed, delicate woman",a fancy date,"The delicate woman in the photo is wearing a light blue, semi-formal dress with a subtle pattern. The dress is
paired with a pair of black heels, which elongate her frame. The dress is cinched at the waist with a belt,
giving her an hourglass shape. The woman's hair is styled in loose waves, framing her face. She accessorizes
with a delicate necklace and a small, gold bracelet. The overall look is chic and feminine, perfect for a date
night."
casual,"a short, curvy man with a muscular build",a picnic,"The fashion outfit for a curvy man with a muscular build at a picnic can be a combination of a light-colored
shirt, a pair of dark-colored chinos, and a pair of comfortable sneakers. The shirt should be tucked in to the
pants and left untucked for a more casual look. The chinos should fit snugly but not be too tight. The
sneakers should be stylish and comfortable, preferably in a neutral color. Accessories such as a watch or a
bracelet can add to the overall look."
bohemian,"a small-framed, delicate woman",a fancy date,"The delicate woman in the bohemian outfit looks effortlessly chic and charming. The earthy tones of the dress
and the accessories complement each other perfectly, while the lace-up boots add a touch of edge. The bohemian
style is completed with a delicate scarf that ties around the neck, adding a touch of elegance to the overall
look."
bohemian,"a short, curvy man with a muscular build",a casual date,"The fashion outfit for a curvy man with a muscular build at a casual date can include a bohemian-style shirt
in earthy tones, paired with a pair of slim-fit jeans. The shirt can be tucked in to highlight the man's
muscular build. A leather belt can complete the look, along with a pair of brown leather shoes. For a more
casual look, a leather jacket can be added over the shirt. The jacket can be left open to showcase the man's
muscular build. The outfit can be accessorized with a leather watch and a leather bracelet."
classic,"a small-framed, delicate woman",a winter vacation,"The delicate woman in the winter vacation outfit is adorned with a classic, timeless style. The ensemble
consists of a tailored, knee-length coat in a rich, neutral color, paired with a soft, feminine scarf. The
coat is accompanied by a pair of classic, round-toed ankle boots, which are embellished with a delicate lace-
up design. The woman's hair is styled in a classic updo, held in place with a delicate, pearl-encrusted clip.
The outfit is completed with a pair of classic, round-framed glasses, and a small, elegant handbag. The
woman's delicate features are accentuated by the classic, timeless style, making her the perfect embodiment of
elegance and sophistication."
classic,"a short, curvy man with a muscular build",a national parks,"The fashion outfit consists of a classic, tailored blazer in a rich, earthy color, paired with a crisp white
shirt and a pair of slim-fit, dark-wash jeans. The blazer features a single button and a pair of slanted side
pockets. The shirt has a subtle check pattern and a classic collar. The jeans are a modern fit, with a high
waist and tapering to the ankle. The outfit is completed with a pair of classic leather dress shoes."
gothic,"a small-framed, delicate woman",a play / concert,"The delicate woman in the gothic outfit stands out from the crowd. Her dark, intricately braided hair frames
her face, while her long, flowing black dress with intricate lace detailing accentuates her small frame. The
ensemble is completed with a pair of black ankle boots, a black choker necklace, and a black leather jacket.
The woman's delicate features are enhanced by the gothic makeup, which includes dark eyeliner, pale skin, and
a deep red lipstick. The outfit is perfect for a gothic-inspired performance or a night out at a concert."
gothic,"a short, curvy man with a muscular build",a birthday party,"The fashion outfit for the gothic-style birthday party would consist of a black tailored suit with a white
dress shirt, a black tie, and black dress shoes. The tailored suit would be a classic fit with a modern twist,
featuring a slim fit and a high waist. The black dress shirt would be a classic Oxford style, with a white
dress shirt underneath. The black tie would be a classic silk tie, and the black dress shoes would be a pair
of black leather dress shoes with a low block heel. The look would be completed with a black leather dress
belt and a black leather dress watch. The outfit would be perfect for a stylish and modern gothic look."
sporty,"a small-framed, delicate woman",a wedding,"The bride's mother, a petite woman, is attending a wedding with her daughter. She wants to look stylish and
chic, but also comfortable and age-appropriate. She chooses a black and white striped dress with a pleated
neckline, paired with a white blazer and black heels. The dress is accessorized with a black and white scarf,
a black handbag, and a pair of black earrings. The outfit is completed with a black fascinator, which
complements the black and white theme."
sporty,"a short, curvy man with a muscular build",a night club,"The fashion outfit consists of a black, slim-fit, long-sleeve t-shirt, paired with a pair of black, slim-fit,
low-rise pants. The t-shirt features a white, embroidered logo of a sports team or a logo of a sports brand.
The pants have a drawstring waist, and the legs taper down to a narrow hem. The outfit is completed with
black, low-top sneakers. The man's muscular build is accentuated by the slim-fit, form-fitting design of the
outfit. The outfit is perfect for a night out at a trendy, modern club."
casual,"a small-framed, delicate woman",a business meeting,"The delicate woman in the business meeting looks chic and stylish in a casual ensemble. She wears a black
collared blouse tucked into a pair of slim-fit black trousers. The trousers are accompanied by a pair of black
ankle boots with a block heel. A black blazer completes the look, adding a touch of elegance to the otherwise
casual outfit."
casual,"a short, curvy man with a muscular build",a concert,"The fashion-conscious short, curvy man with a muscular build looks stylish and confident in a casual ensemble.
He wears a black t-shirt with a graphic print, paired with a pair of slim-fit black jeans. The jeans are
tucked into his black leather boots, which are completed with a matching black leather belt. A black leather
jacket completes the look, adding a layer of sophistication to the ensemble."
