style,role,occasion,description
gothic,"a small-framed, delicate woman",a night club,"The delicate woman in the gothic outfit stands out in the crowded night club. Her dark, intricately braided
hair frames her face, while her long, flowing black dress with intricate lace detailing accentuates her small
frame. The pointed ears and dark makeup complete the look, giving her an air of mystery and elegance. The
intricate lace detailing on her dress adds a touch of elegance to the otherwise dark and daring outfit. The
gothic style is a perfect choice for a night out with friends or a special event."
gothic,"a short, curvy man with a muscular build",a wedding,"The man stands tall and proud in his gothic attire, his dark hair styled in a neat, short cut. His attire
consists of a black tailored suit, adorned with intricate silver embroidery on the lapels and cuffs. The suit
is paired with a crisp white shirt, and a black tie. The man's muscular build is accentuated by the fit of the
suit, which hugs his frame. The outfit is completed with black leather dress shoes, and a black leather belt.
The man's attire is a perfect mix of gothic and modern fashion, making him the perfect gentleman for the
occasion."
sporty,"a small-framed, delicate woman",a birthday party,"The delicate woman in the photo is wearing a sporty outfit that is perfect for a birthday celebration. The
ensemble consists of a white, collared shirt with a subtle pattern, paired with a pair of black, high-waisted
trousers. The trousers are completed with a pair of black, low-top sneakers. The woman's hair is styled in a
neat, shoulder-length cut, which complements the sporty look. The outfit is completed with a black, leather
handbag, which adds a touch of elegance to the sporty style."
sporty,"a short, curvy man with a muscular build",a bachelorette / bachelor party,"The fashion-forward gentleman in a sporty outfit for a bachelorette or bachelor party. The ensemble consists
of a white tee, black track pants, and a pair of black sneakers. The track pants feature a red and white
checkered pattern, while the sneakers have a modern design with a thick sole. The look is completed with a
black baseball cap, a black windbreaker, and a black backpack."
casual,"a small-framed, delicate woman",a graduation,"The delicate woman in the photo is wearing a light blue, collared shirt with a pair of black skinny jeans. The
shirt is tucked in, revealing a bit of her waist. The jeans are snug but not too tight, emphasizing her small
frame. She accessorizes with a simple necklace and a pair of black ankle boots. The overall look is chic and
effortless, perfect for a casual graduation event."
casual,"a short, curvy man with a muscular build",a graduation,"The fashion outfit should be casual and stylish. The man should wear a comfortable, well-fitted shirt in a
solid color, paired with slim-fit jeans and leather shoes. The shirt should have a collar and be tucked in to
show off the man's muscular build. The jeans should be dark wash and have a slim fit. The shoes should be
leather, preferably in a classic brown or black color. Accessories should include a watch and a bracelet. The
outfit should be completed with a stylish, yet simple jacket or blazer. The jacket should be tailored to fit
the man's body and have a lapel collar. The outfit should be kept minimal and simple, with no distracting
patterns or loud colors."
bohemian,"a small-framed, delicate woman",a nature retreat,"The fashion outfit for a delicate woman at a nature retreat. The outfit consists of a bohemian-style dress in
earthy tones, a long-sleeved cardigan, and a pair of comfortable, flat-heeled boots. The dress features a
delicate floral pattern, a deep V-neck, and a tie-back feature. The cardigan is knitted from soft, earthy yarn
and has a wide collar to keep the neck warm. The boots are made from soft leather and have a low block heels.
The outfit is completed with a scarf tied around the neck, a beanie, and a pair of round earrings. The outfit
is perfect for a nature retreat, as the earthy tones and comfortable, practical pieces."
bohemian,"a short, curvy man with a muscular build",a camping / hiking,"The fashion outfit for a curvy man with a muscular build at a camping or hiking trip can be a combination of
bohemian and casual styles. The man can wear a comfortable, light-colored shirt paired with a pair of dark-
wash jeans. A bohemian-style, woven leather belt can be added to complete the look. For a more casual look, a
graphic tee or a plaid button-up shirt can be worn. A pair of hiking boots or sneakers would be appropriate
for the occasion. A wide-brimmed hat or a beanie can add a touch of bohemian flair. The man can also
accessorize with a few simple pieces like a watch or a bracelet. The overall look should be comfortable and
functional for a day of hiking or exploring nature."
classic,"a small-framed, delicate woman",a wedding,"The delicate woman in the photo is wearing a classic, feminine outfit that is perfect for a wedding. The dress
features a delicate lace bodice with a sweetheart neckline, paired with a pleated skirt that falls just above
the knee. The dress is completed with a pair of classic heels and a small, tasteful fascinator. The woman's
hair is styled in a loose, elegant updo that frames her face and adds to the overall feminine charm of the
outfit. The outfit is completed with a small, tasteful handbag and subtle jewellery. The woman's delicate
features are accentuated by the classic, feminine style of the outfit, making her the perfect choice for a
wedding guest."
classic,"a short, curvy man with a muscular build",a semi-casual event,"The gentleman should opt for a classic, timeless look that will make him stand out in a crowd. A tailored,
slim-fit suit in a neutral color, such as black or navy, paired with a crisp white shirt and a solid tie,
would be a great choice. The gentleman should also consider a pair of classic leather dress shoes, such as
loafers or oxfords, to complete the look. For a more casual event, a pair of slim-fit chinos and a comfortable
pair of sneakers would be a great choice."
gothic,"a small-framed, delicate woman",a business lunch,"The woman, a delicate and petite frame, is dressed in a dark, gothic-style ensemble. Her long, dark hair is
styled in loose waves, framing her face. She wears a tailored, black blazer with intricate silver buttons,
paired with a deep red velvet blouse. The blouse is tucked into a high-waisted, black pencil skirt, which
flares out at the knee. The ensemble is completed with black leather ankle boots, a silver necklace, and a
black, structured handbag. The woman's lunch meeting is held in a modern office setting, and her outfit is a
perfect mix of classic gothic style with modern business attire."
gothic,"a short, curvy man with a muscular build",a sports event,"The man stands tall and proud, his muscular build accentuated by his gothic attire. His dark, long hair is
styled in a messy fringe that frames his angular face. A black leather jacket with intricate silver studs is
paired with a deep red velvet shirt, the latter tucked into a pair of black skinny jeans. The jeans are
completed with black combat boots, adding to the overall gothic vibe. The man's accessories include a black
leather wristband and a silver necklace, both embellished with gothic charms. The outfit is completed with a
black leather belt, a black leather backpack, and a black leather wristlet. The man confidently strides onto
the sports field, ready to dominate the game."
sporty,"a small-framed, delicate woman",a fancy date,"The fashion-forward woman in the photo is dressed in a sporty yet chic ensemble. The black and white striped
top is paired with a pair of high-waisted, slim-fit black trousers. The top features a deep V-neck, which
accentuates the delicate neckline. The trousers are completed with a pair of black ankle boots. The woman's
hair is styled in a sleek, straight bob that frames her face. The look is completed with a black leather
handbag and silver hoop earrings. The outfit is perfect for a date night in a trendy restaurant or a night out
on the town."
sporty,"a short, curvy man with a muscular build",a cocktail party,"The fashion-forward man in a sporty outfit stands out at the cocktail party. He wears a white, slim-fit shirt
with a deep red, slim-fit blazer. The blazer features a subtle check pattern and a single breasted design. The
man pairs this with black dress pants and black leather dress shoes. The outfit is completed with a black
leather belt and a black leather watch. The man's hair is styled in a neat, short cut. The outfit is a perfect
blend of sporty and stylish."
casual,"a small-framed, delicate woman",a winter vacation,"The fashion outfit consists of a cozy, oversized, cream-colored sweater paired with a pair of slim-fit black
trousers and a pair of black ankle boots. The sweater features a round neckline and long sleeves, while the
trousers have a high waist and a slim fit. The boots are classic black ankle boots with a low block heel. The
outfit is completed with a black scarf and a black hat."
casual,"a short, curvy man with a muscular build",a winter vacation,"The fashion outfit for a curvy man with a muscular build can include a warm, cozy sweater in a neutral color,
paired with a pair of slim-fit jeans and a pair of comfortable sneakers. For a more formal look, a classic
wool blazer can be added over a dress shirt and a pair of dress shoes. Accessories such as a watch or a
leather belt can add a touch of elegance to the outfit."
bohemian,"a small-framed, delicate woman",a casual gathering,"The delicate woman in the bohemian outfit looks effortlessly chic and stylish. The earthy tones of the dress
and the accessories complement each other perfectly, creating a bohemian yet elegant look. The dress features
a sweetheart neckline, which accentuates the neckline and adds a touch of vintage charm. The dress is made of
a lightweight, breathable fabric that is perfect for a casual gathering. The delicate lace-up details on the
dress add a touch of bohemian flair. To complete the look, the woman accessorizes with a small pendant
necklace, a delicate bracelet, and a small, woven bag. The outfit is completed with a pair of comfortable,
block-heel sandals. The overall look is both feminine and bohemian, making the woman stand out in a crowd."
bohemian,"a short, curvy man with a muscular build",a job interview,"The fashion outfit consists of a bohemian-style, long-sleeve shirt in earthy tones, paired with a pair of
slim-fit, high-waisted trousers. The shirt features intricate embroidery or patterns, while the trousers have
a subtle, earthy-toned plaid pattern. The outfit is completed with a pair of brown leather dress shoes, a
vintage-style watch, and a leather belt. The overall look is one that exudes confidence and sophistication."
classic,"a small-framed, delicate woman",a bachelorette / bachelor party,"The delicate, petite woman in the classic style outfit is a vision to behold. The tailored, feminine blouse in
a rich, earthy hue is paired with a pleated skirt in a complementary hue. The ensemble is completed with a
pair of classic pumps in a neutral color. The woman's delicate features are accentuated by the classic
hairstyle, a side-parting with soft waves. The outfit is perfect for a bachelorette or bachelor party, where
the woman can feel confident and elegant in her classic style."
classic,"a short, curvy man with a muscular build",a night club,"The man walks into the night club, dressed in a classic style. His outfit consists of a black tailored suit, a
crisp white shirt, and a black tie. The suit is tailored to fit his muscular build, emphasizing his strong
frame. The man's hair is styled neatly, and he sports a classic side part. He wears black leather dress shoes,
completing the look. The man confidently strides through the club, his presence commanding attention."
gothic,"a small-framed, delicate woman",a bachelorette / bachelor party,"The delicate, petite woman in the gothic outfit is a vision to behold. The dark, rich colors of the velvet and
lace pieces are a perfect match for her small frame, and the intricate details of the corset and long skirt
accentuate her delicate features. The long, dark hair is styled in an elaborate updo, and the makeup is kept
minimal, with a bold eyeliner and pale lips. The outfit is completed with a pair of black ankle boots, which
add a touch of gothic flair to the otherwise elegant look."
gothic,"a short, curvy man with a muscular build",a concert,"The man stands tall and muscular, dressed in a black leather jacket with intricate silver studs along the
collar and sleeves. The jacket is paired with a white t-shirt, black jeans, and black combat boots. The man's
hair is styled in a messy undercut, framing his angular face. The ensemble is completed with a black leather
belt and a silver buckle, as well as a black leather backpack. The man's accessories include a black leather
wristwatch and a silver necklace with a pendant of a skull. The man's outfit is a perfect mix of gothic and
modern fashion, making him stand out in the crowd."
sporty,"a small-framed, delicate woman",a business lunch,"The delicate woman in the business lunch setting is dressed in a sporty yet chic ensemble. The ensemble
consists of a white blouse paired with a black pencil skirt, which is tucked into a pair of black ankle boots.
The blouse is adorned with a subtle yet elegant pattern, while the boots are embellished with a gold chain.
The woman accessorizes with a delicate gold necklace and a matching bracelet. The look is completed with a
black blazer, which is tailored to fit her small frame. The ensemble is a perfect mix of business and fashion,
making the woman look both confident and stylish."
sporty,"a short, curvy man with a muscular build",a beach,"The fashion outfit consists of a white and red striped shirt, paired with a pair of black shorts. The shirt
features a red and white striped collar, and the shorts have a red and white striped elasticated waistband.
The outfit is completed with a pair of black and white striped running shoes."
casual,"a small-framed, delicate woman",a wedding,"The delicate woman in the photo is wearing a light blue, collared shirt with a pair of black dress pants. The
shirt is tucked in, revealing a bit of her waist. The pants are slightly tapered, giving her a slim
silhouette. She accessorizes with a pair of black heels and a matching black handbag. Her hair is styled in
loose waves, framing her face. The overall look is chic and feminine, perfect for a wedding."
casual,"a short, curvy man with a muscular build",a birthday party,"The fashion-conscious man in the photo is wearing a casual outfit that is perfect for a birthday celebration.
The man is wearing a white t-shirt, a pair of dark-wash jeans, and a pair of black sneakers. The t-shirt is
tucked in, revealing a bit of the man's muscular build. The jeans are slightly loose, giving the outfit a
relaxed and comfortable vibe. The sneakers are classic black, with a modern twist, featuring a white sole. The
man is accessorized with a black leather watch and a silver necklace. The outfit is completed with a black
leather jacket, adding a layer of sophistication to the casual look."
bohemian,"a small-framed, delicate woman",a winter vacation,"The delicate, petite woman can pull off a bohemian look with ease. Start with a comfortable, oversized sweater
in a neutral color, paired with a pair of high-waisted, wide-leg trousers. A scarf or shawl can add an extra
layer of warmth and style. For footwear, go with a pair of ankle boots or loafers. Don't forget to accessorize
with a few delicate jewelry pieces, like a pendant necklace or a bracelet. The key is to keep the look
effortless and chic, with a focus on layering and texture."
bohemian,"a short, curvy man with a muscular build",a cocktail party,"The fashion-forward man in a bohemian style outfit looks effortlessly chic at a cocktail party. The man's
muscular build is highlighted by a tailored fit, which is achieved through a well-tailored blazer. The blazer
is paired with a crisp white shirt, which is tucked into a pair of slim-fit black trousers. The trousers are
completed with a pair of black leather dress shoes. The man's accessories include a silver watch and a leather
belt. The man's outfit is completed with a black fedora, which adds a touch of vintage charm to the ensemble."
classic,"a small-framed, delicate woman",a music festival,"The delicate woman in the photo is wearing a classic, feminine outfit that is perfect for a day at a music
festival. The ensemble consists of a white blouse with a Peter Pan collar, paired with a pleated skirt in a
pastel hue. The woman's hair is styled in a loose, retro updo that frames her face. She accessorizes with a
delicate gold necklace and a matching bracelet. The outfit is completed with a pair of vintage-style
sunglasses and a small leather handbag. The overall look is one of timeless elegance and femininity."
classic,"a short, curvy man with a muscular build",a sports event,"The gentleman stands tall and confident in his classic, timeless style. His tailored black blazer is paired
with a crisp white shirt and a slim-fit pair of black trousers. The gentleman's attire is completed with a
pair of black leather dress shoes. The gentleman's muscular build is accentuated by the classic, tailored fit
of his garments. The gentleman's outfit is perfect for a day at a sports event, where he can confidently strut
his stuff in style."
gothic,"a small-framed, delicate woman",a conference,"The delicate, petite woman in the conference room is dressed in a dark, gothic-style ensemble. Her long, dark
hair is styled in a loose, yet elegant updo. She dons a black velvet, high-necked dress with intricate lace
detailing, paired with a matching black velvet choker. The dress falls just above her knees, revealing a pair
of black leather knee-high boots. The ensemble is completed with a black velvet cape, adorned with silver
grommets and a deep red satin lining. The cape is draped elegantly over her shoulders, adding an extra layer
of sophistication to the already-stylish look."
gothic,"a short, curvy man with a muscular build",a bar,"The man walks into the bar, dressed in a dark, tailored suit with a long, black overcoat. His muscular build
is accentuated by the form-fitting cut of the suit. The man's hair is styled in a classic undercut, while his
beard is neatly trimmed. The man's eyes are framed by black metal frames, giving him a mysterious, yet
approachable look. The man's outfit is completed with a pair of black leather boots, adding to his overall
gothic aesthetic."
sporty,"a small-framed, delicate woman",a casual date,"The fashion outfit consists of a white, collared shirt paired with a pair of black, high-waisted trousers. The
shirt is tucked in, revealing a hint of the delicate woman's back. The trousers are tailored to fit her small
frame, emphasizing her feminine curves. The ensemble is completed with a pair of black, low-heeled pumps. The
look is styled with a black, wide-brimmed hat, which complements the sporty vibe. The outfit is perfect for a
casual date, where the woman can feel comfortable and confident in her own skin."
sporty,"a short, curvy man with a muscular build",a casual gathering,"The fashion-conscious short, curvy man with a muscular build can look stylish and sporty in this casual
outfit. Start with a white tee and pair it with a pair of black track pants. Add a pop of color with a bright-
colored track jacket. For a more formal look, swap the track pants for dress pants and add a dress shirt. To
complete the look, add a pair of black sneakers and a leather watch."
casual,"a small-framed, delicate woman",a nature retreat,"The delicate, petite woman steps out of her cabin at the nature retreat, dressed in a comfortable, casual
outfit. Her long, wavy hair falls in loose waves around her face, framing her heart-shaped face. She wears a
soft, cream-colored sweater with a subtle pattern, paired with a pair of dark-wash skinny jeans and a pair of
cozy, taupe ankle boots. A simple necklace adds a touch of elegance to her look, while a small backpack
complements her outfit. The serene nature surrounding her provides the perfect backdrop for her stylish, yet
practical outfit."
casual,"a short, curvy man with a muscular build",a beach,"The fashion outfit consists of a white t-shirt, a pair of black shorts, and a pair of black sneakers. The
t-shirt is a relaxed fit and features a round neckline. The shorts have a drawstring waist and are made of
lightweight, breathable fabric. The sneakers are a classic pair of black canvas shoes with white accents. The
outfit is completed with a black baseball cap."
bohemian,"a small-framed, delicate woman",a birthday party,"The delicate woman in the bohemian style outfit looks like a bohemian dream come true. The outfit consists of
a white blouse with lace detailing, paired with a floral print skirt that flares out at the bottom. The skirt
is accompanied by a brown leather belt, which accentuates the waist. A pair of brown leather ankle boots
completes the look, adding a touch of bohemian flair. The woman's hair is styled in loose waves, framing her
delicate face. The overall vibe of the outfit is one of effortless elegance and bohemian charm."
bohemian,"a short, curvy man with a muscular build",a casual date,"The fashion outfit for a curvy man with a muscular build at a casual date can include a bohemian-style shirt
in earthy tones, paired with a pair of slim-fit jeans. The shirt can be tucked in to highlight the man's
muscular build. A leather belt can complete the look, along with a pair of brown leather shoes. For a more
casual look, a leather jacket can be added over the shirt. The jacket can be left open to showcase the man's
muscular build. The outfit can be accessorized with a leather watch and a leather bracelet."
classic,"a small-framed, delicate woman",a beach,"The delicate woman stands tall on the beach, her small frame perfectly proportioned with the classic style she
sports. Her hair is styled in a soft, loose waves that cascade down her back, framing her face. She wears a
simple white blouse, paired with a classic black skirt that falls just above her knees. The skirt is
accompanied by a pair of black heels, completing the classic look. The woman's accessories are minimal, with a
simple necklace and a single bracelet. The outfit is a perfect mix of classic and modern, making the woman
stand out in a crowd."
classic,"a short, curvy man with a muscular build",a music festival,"The fashion-conscious man stands tall and confident in his classic style outfit. His tailored black blazer is
paired with a crisp white shirt, a slim-fit black tie, and black dress shoes. The man's muscular build is
accentuated by the black blazer, which is cinched at the waist to create a streamlined silhouette. The man's
dark hair is styled neatly, and his facial features are framed by a pair of black sunglasses. The man's outfit
is completed with a pair of black leather dress shoes, which are polished to a shine. The man confidently
strides through the music festival, turning heads with his timeless style."
gothic,"a small-framed, delicate woman",a business lunch,"The woman, a delicate and petite frame, is dressed in a dark, gothic-style ensemble. Her long, dark hair is
styled in loose waves, framing her face. She wears a tailored, black blazer with intricate silver buttons,
paired with a deep red velvet blouse. The blouse is tucked into a high-waisted, black pencil skirt, which
flares out at the knee. The ensemble is completed with black leather ankle boots, a silver necklace, and a
black, structured handbag. The woman's lunch meeting is held in a modern office setting, and her outfit is a
perfect mix of classic gothic style with modern business attire."
gothic,"a short, curvy man with a muscular build",a work / office event,"The fashion outfit consists of a black tailored suit with a red and black striped tie, a white dress shirt,
and black dress shoes. The suit is tailored to fit the man's muscular build, while the striped tie adds a
touch of gothic style. The white dress shirt is tucked in, showcasing the man's muscular build. The black
dress shoes complete the look, with the red and black striped tie being the focal point. The outfit is perfect
for a formal work or office event, while still maintaining a gothic aesthetic."
sporty,"a small-framed, delicate woman",a sports event,"The delicate woman in the image is wearing a black and white striped top with a pair of black and white
striped shorts. The top is tucked in to reveal a pair of white sneakers. The woman is also wearing a black and
white striped headband to complete the sporty look. The outfit is perfect for attending a sports event or
running errands in a casual yet chic manner."
sporty,"a short, curvy man with a muscular build",a bar,"The man is dressed in a black and white checkered shirt, paired with a pair of black track pants. The track
pants have a drawstring waist, and the man wears a pair of black and white sneakers. The man's hair is styled
in a short, neat cut that frames his face. The man is wearing a black and white checkered scarf, which is
knotted around his neck. The man is holding a black and white checkered scarf in his hand, which he uses to
tie back his hair. The man is also wearing a black and white checkered beanie, which is pulled down low on his
head. The man is sitting at a bar, sipping on a drink and enjoying the atmosphere."
