style,role,occasion,description
bohemian,"a small-framed, delicate woman",a work / office event,"The delicate, petite woman can pull off a bohemian look with ease. Start with a simple, neutral-colored dress
or blouse, paired with a statement necklace or scarf. A maxi skirt or flowy pants can add volume and movement.
For shoes, opt for comfortable flats or block-heel sandals. A boho-style bag or a crossbody bag can complete
the look. Accessories like a headband, a scarf, or a belt can add a touch of bohemian flair. The key is to
keep the look effortless and natural, with loose waves or a braid for hair."
bohemian,"a short, curvy man with a muscular build",a casual date,"The fashion outfit for a curvy man with a muscular build at a casual date can include a bohemian-style shirt
in earthy tones, paired with a pair of slim-fit jeans. The shirt can be tucked in to highlight the man's
muscular build. A leather belt can complete the look, along with a pair of brown leather shoes. For a more
casual look, a leather jacket can be added over the shirt. The jacket can be left open to showcase the man's
muscular build. The outfit can be accessorized with a leather watch and a leather bracelet."
classic,"a small-framed, delicate woman",a play / concert,"The delicate woman in the classic fashion outfit looks stunning. The tailored blazer in a rich, deep red color
complements the feminine floral dress. The dress features a delicate lace collar and intricate details on the
bodice. The woman accessorizes with a small pearl necklace and a classic handbag in a complementary shade. The
ensemble is completed with classic pumps in a matching deep red hue."
classic,"a short, curvy man with a muscular build",a work / office event,"The gentleman stands tall and confident in his classic, tailored attire. His well-fitted, dark-blue suit is
paired with a crisp white shirt, a black tie, and polished black dress shoes. The ensemble is completed with a
leather briefcase in hand, adding a touch of elegance to the overall look. The man's muscular build is
accentuated by the fit of the tailored suit, while his strong facial features are highlighted by a neatly
trimmed beard. The outfit is perfect for a professional setting, such as a work event, and will make the
gentleman stand out in a crowd."
gothic,"a small-framed, delicate woman",a beach,"The delicate woman stands at the beach, her small frame adorned with intricate gothic details. Her dark hair
is styled in loose waves, framing her heart-shaped face. A black velvet dress with intricate lace detailing is
paired with a long black cloak, its edges trimmed with intricate silver embroidery. The cloak is fastened with
a large silver clasp at the neck, adding to the gothic aesthetic. The woman's delicate features are
accentuated by the dark makeup and gothic jewelry, including a silver necklace with a pendant in the shape of
a skull. The ensemble is completed with black ankle boots, adding to the overall gothic vibe."
gothic,"a short, curvy man with a muscular build",a business lunch,"The gentleman dons a black tailored suit with a crisp white shirt and a deep red tie. The suit is adorned with
intricate silver buttons and a black leather belt. The man's muscular build is accentuated by a pair of black
leather dress shoes. The gentleman accessorizes his outfit with a black leather briefcase and a silver cuff
bracelet. The ensemble is completed with a black fedora, a pair of black sunglasses, and a black leather
briefcase."
sporty,"a small-framed, delicate woman",a beach,"The delicate woman stands tall at the beach, wearing a white and red striped top with a pair of black shorts.
The top is tucked in, revealing a pair of white sneakers. The woman accessorizes with a red and white striped
headband, completing the look with a red and white striped scarf. The woman's delicate features are
accentuated by the sporty style, making her the perfect beach companion."
sporty,"a short, curvy man with a muscular build",a play / concert,"The fashion outfit should be comfortable and stylish. The man should wear a pair of black or dark blue jeans,
a white or light gray t-shirt, and a black or dark blue blazer. The blazer should have a slim fit and be
tailored to fit the man's muscular build. The t-shirt should be tucked in and the jeans should be worn with a
belt. The blazer can be left open to show off the man's muscular build. The outfit should also include a pair
of black or dark blue sneakers. The sneakers should be stylish and comfortable, and should match the rest of
the outfit. The man should also accessorize with a watch or a bracelet. The outfit should be completed with a
black or dark blue baseball cap."
casual,"a small-framed, delicate woman",a halloween party,"The delicate woman in the image is wearing a black, long-sleeved dress with a white collar and matching belt.
The dress is paired with a pair of black tights and black ankle boots. She accessorizes with a simple necklace
and a black scarf. Her hair is styled in a loose, shoulder-length cut. The overall look is a perfect mix of
casual and chic, making her the perfect costume choice for a Halloween party."
casual,"a short, curvy man with a muscular build",a gala / exhibition opening,"The fashion-forward gentleman stands tall and confident in his tailored black suit, which is paired with a
crisp white shirt and a classic red tie. The ensemble is completed with a pair of black dress shoes, elevating
the look with a touch of elegance. The man's muscular build is accentuated by the fit of the tailored suit,
while his muscular arms are highlighted by the sleeves that end just above the elbow. The man's accessories
are kept minimal, with a simple silver watch and a classic black leather belt. The overall look is a perfect
mix of casual and formal styles, making the gentleman stand out in a crowd."
bohemian,"a small-framed, delicate woman",a bar,"The delicate woman sips her drink, her long hair cascading down her back. She wears a bohemian-style dress,
adorned with intricate patterns and earthy tones. The dress flows gently, emphasizing her small frame. The
neckline is embellished with a delicate lace collar. She accessorizes with a few simple pieces, including a
delicate necklace and a small bracelet. The woman's delicate features are accentuated by the bohemian style,
making her look both timeless and modern."
bohemian,"a short, curvy man with a muscular build",a sports event,"The fashion-forward man stands out in a crowd with a bohemian-inspired ensemble. A pair of vintage-style,
wide-leg trousers in earthy tones, such as brown or olive green, paired with a crisp white shirt, is a classic
choice. A patterned, bohemian-style scarf, worn casually around the neck, adds a touch of color and
personality. A leather jacket, in a rich, earthy hue, completes the look. The man's muscular build is
accentuated by the addition of a leather belt, which cinches the waist and pulls the outfit together. The
outfit is perfect for a day at a sports event, where the man can show off his unique style while still
remaining comfortable and confident."
classic,"a small-framed, delicate woman",a cruise,"The fashion outfit consists of a tailored black blazer with a single button, paired with a crisp white blouse,
high-waisted black trousers, and black leather loafers. The ensemble is completed with a classic red scarf and
a black handbag."
classic,"a short, curvy man with a muscular build",a national parks,"The fashion outfit consists of a classic, tailored blazer in a rich, earthy color, paired with a crisp white
shirt and a pair of slim-fit, dark-wash jeans. The blazer features a single button and a pair of slanted side
pockets. The shirt has a subtle check pattern and a classic collar. The jeans are a modern fit, with a high
waist and tapering to the ankle. The outfit is completed with a pair of classic leather dress shoes."
gothic,"a small-framed, delicate woman",a wedding,"The delicate woman in the photo is wearing a dark, intricately designed dress with long sleeves and a high
neckline. The dress is adorned with intricate lace details and a deep V-neck. The woman's hair is styled in an
elegant updo, held in place with a black headband. She is wearing a pair of black ankle boots with a block
heel, and a black choker necklace. The overall look is gothic and elegant, perfect for a wedding."
gothic,"a short, curvy man with a muscular build",a fancy date,"The man is dressed in a dark, tailored suit with a high collar and long sleeves. The suit is made of a fine,
black wool blend and is adorned with intricate silver buttons. The man's hair is styled in a neat, short crop
that frames his angular face. His muscular build is accentuated by the fit of the suit, which hugs his body
tightly. The man's accessories include a silver necklace with a pendant that glimmers in the light, as well as
a pair of silver cufflinks. The man's shoes are polished black leather, with a thick sole and a classic
pointed toe. The outfit is completed with a black silk scarf, knotted at the neck, which adds a touch of
elegance to the ensemble."
sporty,"a small-framed, delicate woman",a concert,"The delicate woman in the photo is wearing a black and white striped top with a pair of black skinny jeans.
She has a white sports bra underneath, and a black and white striped scarf tied around her neck. The woman is
also wearing a pair of black and white sneakers, which match the striped top. The outfit is completed with a
black and white striped beanie, which matches the scarf. The woman's hair is styled in a messy bun, which
complements the sporty look. The overall vibe of the outfit is chic and sporty, making it perfect for a
concert."
sporty,"a short, curvy man with a muscular build",a play / concert,"The fashion outfit should be comfortable and stylish. The man should wear a pair of black or dark blue jeans,
a white or light gray t-shirt, and a black or dark blue blazer. The blazer should have a slim fit and be
tailored to fit the man's muscular build. The t-shirt should be tucked in and the jeans should be worn with a
belt. The blazer can be left open to show off the man's muscular build. The outfit should also include a pair
of black or dark blue sneakers. The sneakers should be stylish and comfortable, and should match the rest of
the outfit. The man should also accessorize with a watch or a bracelet. The outfit should be completed with a
black or dark blue baseball cap."
casual,"a small-framed, delicate woman",a camping / hiking,"The delicate woman hikes through the woods in a casual yet stylish outfit. She wears a light-blue, button-up
shirt with a white collar, paired with a pair of dark-wash skinny jeans. The jeans are tucked into her black
ankle boots, which are adorned with a subtle gold chain. A cozy, cream-colored sweater completes the look, and
a small backpack adds a touch of practicality. The woman accessorizes with a delicate gold necklace and a
simple watch. Her hair is styled in a loose, beachy wave, and she carries a small, leather crossbody bag. The
overall look is both feminine and functional, perfect for a day spent outdoors."
casual,"a short, curvy man with a muscular build",a music festival,"The fashion-conscious short, curvy man with a muscular build can look stylish and comfortable in a casual
outfit at a music festival. Start with a pair of dark-wash jeans and a simple white t-shirt. Then add a
leather jacket in a complementary color, like black or brown. Layer with a graphic tee or a button-up shirt.
For footwear, go with a pair of sneakers or loafers. Accessories can include a watch, a bracelet, or a beanie.
Don't forget to accessorize with a stylish backpack or a belt. The key is to keep it simple and casual, but
still put together a great look."
bohemian,"a small-framed, delicate woman",a camping / hiking,"The delicate, small-framed woman can pull off a bohemian look with ease. Start with a comfortable, flowy dress
in a neutral color, such as a light blue or green. Pair it with a wide-brimmed hat and a pair of vintage-style
sunglasses. A woven bag or backpack in earthy tones, such as brown or beige, will complete the look. For a
more formal occasion, add a blouse and a pair of high-waisted trousers. Don't forget to accessorize with
delicate jewelry, such as a pendant necklace or a bracelet. Finally, don't forget to wear comfortable,
supportive shoes, such as sandals or flats."
bohemian,"a short, curvy man with a muscular build",a national parks,"The bohemian style is a perfect fit for a man with a muscular build and a short stature. The outfit should
consist of comfortable, loose-fitting clothing that is easy to move in. A pair of high-waisted, wide-leg pants
would be a great choice. A long, flowy shirt or a button-up shirt with a relaxed fit would complete the look.
For footwear, a pair of sturdy, comfortable boots or sandals would be ideal. Accessories such as a scarf, a
hat, or a watch can add a touch of bohemian flair. The colors should be earthy and neutral, such as brown,
green, and blue. The outfit should be accessorized with items that reflect the natural environment, such as a
leather belt or a woven bracelet."
classic,"a small-framed, delicate woman",a concert,"The delicate woman in the classic outfit looks like a timeless beauty. The tailored black dress with a white
collar and delicate lace details is a classic piece that is always in style. The dress is paired with a pair
of black heels, which elongate her frame and add a touch of elegance to the ensemble. The delicate lace
details on the dress and the white collar add a feminine touch to the outfit. The woman's hair is styled in a
classic updo, which complements the classic look. The outfit is completed with a small pearl necklace and a
delicate bracelet. The woman's delicate features are enhanced by the classic makeup, which includes a subtle
winged eyeliner and a neutral palette for the lips. Overall, the woman's classic outfit is a timeless beauty
that exudes elegance and sophistication."
classic,"a short, curvy man with a muscular build",a work / office event,"The gentleman stands tall and confident in his classic, tailored attire. His well-fitted, dark-blue suit is
paired with a crisp white shirt, a black tie, and polished black dress shoes. The ensemble is completed with a
leather briefcase in hand, adding a touch of elegance to the overall look. The man's muscular build is
accentuated by the fit of the tailored suit, while his strong facial features are highlighted by a neatly
trimmed beard. The outfit is perfect for a professional setting, such as a work event, and will make the
gentleman stand out in a crowd."
gothic,"a small-framed, delicate woman",a cocktail party,"The delicate woman in the gothic outfit stands out at the cocktail party. Her dark, intricately designed dress
is adorned with intricate lace details, and her long, dark hair is styled in an elaborate updo. The woman's
makeup is kept minimal, with a subtle hint of eyeliner and a bold red lip. She accessorizes with a pair of
silver earrings and a delicate necklace, and her small frame is accentuated by the high heels she wears. The
overall look is both elegant and mysterious, drawing attention to the woman's unique style."
gothic,"a short, curvy man with a muscular build",a casual date,"The man stands tall and proud, his muscular build accentuated by his dark, form-fitting attire. His long, dark
hair is styled in a classic undercut, framing his angular face. The man's attire consists of a black, tailored
suit with intricate details, such as silver buttons and a satin lapel. The suit is paired with black leather
dress shoes, completing the look. The man's accessories include a black leather belt and a silver necklace.
The man's outfit is a perfect mix of gothic and modern fashion, making him the perfect date for any casual
occasion."
sporty,"a small-framed, delicate woman",a casual gathering,"The fashionista in question is a petite woman with delicate features. She's wearing a white blouse tucked into
a pair of high-waisted black trousers, which are paired with a pair of black ankle boots. The ensemble is
completed with a black blazer, which is tailored to fit her frame. The woman accessorizes with a pair of
silver hoop earrings and a delicate gold necklace. The outfit is perfect for a casual gathering with friends."
sporty,"a short, curvy man with a muscular build",a beach,"The fashion outfit consists of a white and red striped shirt, paired with a pair of black shorts. The shirt
features a red and white striped collar, and the shorts have a red and white striped elasticated waistband.
The outfit is completed with a pair of black and white striped running shoes."
casual,"a small-framed, delicate woman",a play / concert,"The delicate woman in the photo is wearing a light blue, oversized, button-up shirt with a pair of black
skinny jeans. She accessorizes with a simple necklace and a pair of black ankle boots. The outfit is completed
with a black leather jacket and a black scarf knotted around her neck. The casual style is perfect for a day
at the park or a play, and the oversized shirt and skinny jeans will keep her comfortable and chic."
casual,"a short, curvy man with a muscular build",a nature retreat,"The fashion outfit for a curvy man with a muscular build at a nature retreat can be a combination of a
comfortable and stylish look. The man can opt for a light, neutral color palette, such as beige, gray, or
khaki. A classic, well-tailored fit is important, but not too tight. For a more casual look, a relaxed fit is
fine. A versatile pair of sneakers or loafers would complete the look. A light, breathable fabric like linen
or cotton is ideal for a nature retreat. A simple, yet stylish accessory like a leather watch or a classic
metal belt buckle can add a touch of elegance to the outfit. The man can also choose a comfortable, breathable
fabric like linen or cotton for a more casual look. A classic, well-tailored fit is important, but not too
tight. A pair of sneakers or loafers would complete the look. A light, breathable fabric like linen or cotton
is ideal for a nature retreat. A simple, yet stylish accessories like a leather watch or a classic metal belt
buckle can add a touch of elegance to the outfit."
bohemian,"a small-framed, delicate woman",a camping / hiking,"The delicate, small-framed woman can pull off a bohemian look with ease. Start with a comfortable, flowy dress
in a neutral color, such as a light blue or green. Pair it with a wide-brimmed hat and a pair of vintage-style
sunglasses. A woven bag or backpack in earthy tones, such as brown or beige, will complete the look. For a
more formal occasion, add a blouse and a pair of high-waisted trousers. Don't forget to accessorize with
delicate jewelry, such as a pendant necklace or a bracelet. Finally, don't forget to wear comfortable,
supportive shoes, such as sandals or flats."
bohemian,"a short, curvy man with a muscular build",a halloween party,"The fashion-forward man stands out in a crowd with a bohemian-inspired ensemble. His short, muscular build is
accentuated by a pair of vintage-style, high-waisted trousers in earthy tones. A patterned, long-sleeved shirt
in earthy tones completes the look, while a leather jacket adds a layer of sophistication. The man
accessorizes with a leather belt and a vintage watch, completing the look with a pair of brown leather boots."
classic,"a small-framed, delicate woman",a picnic,"The delicate woman in the photo is wearing a classic, feminine ensemble that exudes elegance and grace. The
pastel floral dress features a delicate lace collar and intricate details on the bodice. The dress is paired
with a white, wide-brimmed hat that accentuates her delicate features. The woman is sitting on a blanket,
enjoying the sunshine and the fresh air at a picnic. Her delicate features are highlighted by the soft,
natural light that filters through the trees. The overall look is one of timeless elegance and femininity."
classic,"a short, curvy man with a muscular build",a bar,"The gentleman walks into the bar, dressed in a classic style. His attire consists of a tailored black blazer,
a crisp white shirt, and a pair of slim-fit black trousers. The blazer is adorned with a pair of silver
buttons, while the shirt features a subtle check pattern. The trousers are fitted to his muscular frame, with
a pair of black leather dress shoes completing the look. The gentleman's hair is styled neatly, and he sports
a classic side part. His accessories consist of a silver watch and a black leather belt. The overall look
exudes confidence and elegance, making him the perfect gentleman for any occasion."
gothic,"a small-framed, delicate woman",a winter vacation,"The delicate, small-framed woman can pull off a gothic fashion look with ease. Start with a base of black or
dark purple, and layer with intricate details like lace, chains, and studs. A velvet or leather jacket will
add an extra layer of warmth. For a touch of color, incorporate a pop of red or green into the mix. Don't
forget to accessorize with gothic-style jewelry like chains, skulls, and crosses. And finally, complete the
look with a pair of knee-high boots or ankle boots."
gothic,"a short, curvy man with a muscular build",a conference,"The fashion outfit consists of a black, long-sleeve, Victorian-style shirt with intricate lace detailing,
paired with a dark, tailored, high-waisted trousers. The trousers are accompanied by a pair of black leather
dress shoes with thick, round laces. The outfit is completed with a black, tailored waistcoat, adorned with
intricate lace detailing, and a black, top hat with a matching ribbon. The overall look is a mix of classic
gothic elements, such as the Victorian collar and lace, with modern tailoring and contemporary styling."
sporty,"a small-framed, delicate woman",a bar,"The delicate woman in the bar sports a sporty yet feminine look. She wears a white blouse tucked into a pair
of high-waisted black trousers, which are completed with a pair of black ankle boots. The ensemble is
accessorized with a black leather belt and a gold necklace. The woman's hair is styled in a neat bob, while
her makeup is kept minimal, featuring a subtle pink lip and neutral eyeshadow."
sporty,"a short, curvy man with a muscular build",a fancy date,"The fashion outfit consists of a black, slim-fit, long-sleeve, collared shirt paired with a pair of black,
slim-fit, high-waisted trousers. The shirt features a white, vertical stripe running down the center, while
the trousers have a red, vertical stripe running down the side. The outfit is completed with a pair of black,
low-top, running shoes."
casual,"a small-framed, delicate woman",a fancy date,"The delicate woman in the photo is wearing a light blue, semi-formal dress with a subtle pattern. The dress is
paired with a pair of black heels, which elongate her frame. The dress is cinched at the waist with a belt,
giving her an hourglass shape. The woman's hair is styled in loose waves, framing her face. She accessorizes
with a delicate necklace and a small, gold bracelet. The overall look is chic and feminine, perfect for a date
night."
casual,"a short, curvy man with a muscular build",a sports event,"The fashion outfit consists of a black, slim-fit, long-sleeve t-shirt, paired with a pair of dark-wash,
straight-leg jeans. The t-shirt features a graphic of a basketball hoop, while the jeans have a subtle,
monochrome check pattern. The outfit is completed with a pair of black sneakers."
bohemian,"a small-framed, delicate woman",a cocktail party,"The delicate woman in the bohemian outfit looks effortlessly chic and stylish. The ensemble consists of a
vintage-style, floral-print dress paired with a cream-colored, tailored blazer. The dress features a tie-neck
detail and a flared hem, while the blazer has a single button and subtle lapels. To complete the look, she
wears a pair of round-toed, block-heel pumps in a neutral color. The outfit is perfect for a cocktail party or
any other formal event."
bohemian,"a short, curvy man with a muscular build",a play / concert,"The bohemian fashion style is a perfect choice for a short, curvy man with a muscular build. The key pieces to
look for include a boho-style shirt, a pair of high-waisted, wide-leg trousers, and a comfortable pair of
boots. For a more formal look, try pairing a tailored blazer with a dress shirt and slim-fit trousers. Don't
forget to accessorize with a few statement pieces like a leather belt, a watch, or a stylish scarf. The outfit
can be completed with a leather backpack or a crossbody bag for hands-free convenience."
classic,"a small-framed, delicate woman",a gala / exhibition opening,"The delicate woman in the classic fashion outfit looks stunning at the opening of a fashion exhibition. The
ensemble consists of a tailored black dress with intricate lace detailing, paired with a delicate pearl
necklace and matching earrings. The dress is cinched at the waist with a black belt, accentuating the woman's
small frame. The ensemble is completed with black heels, adding to the elegance of the outfit."
classic,"a short, curvy man with a muscular build",a semi-casual event,"The gentleman should opt for a classic, timeless look that will make him stand out in a crowd. A tailored,
slim-fit suit in a neutral color, such as black or navy, paired with a crisp white shirt and a solid tie,
would be a great choice. The gentleman should also consider a pair of classic leather dress shoes, such as
loafers or oxfords, to complete the look. For a more casual event, a pair of slim-fit chinos and a comfortable
pair of sneakers would be a great choice."
